[
  {
    "altitude" : 23.375564581136974,
    "bearingRadians" : 1.3416965000000001,
    "course" : 76.873546882061802,
    "floor" : 3,
    "horizontalAccuracy" : 6,
    "relativeDistance" : 2.1164507282484935,
    "speed" : 1.0289180278778076,
    "stepPath" : "Cardio 12MT/run/runDistance",
    "timestamp" : 52.422324001789093,
    "timestampDate" : "2023-06-05T15:47:38.570-07:00",
    "timestampUnix" : 1686005258.5697851,
    "totalDistance" : 63.484948023273581,
    "uptime" : 99494.629004376795,
    "verticalAccuracy" : 3
  }
]